[
 {
  "id": "EVO_001",
  "nom": "Soleil de l'Uchiha",
  "statut": "CO",
  "type": "EVOLUTION",
  "sources": [
   "JUT_001"
  ],
  "catalyseurs": [
   "PAS_021"
  ],
  "comportement": "La grande boule de feu grossit en traversant les ennemis (perce 6) puis explose en 3 boules secondaires qui repartent en étoile.",
  "valeurs": "Impact 70 ; explosion 40 (r 2,5 m) ; 3 × 25 ; délai 1,8 s",
  "limites": "Boules secondaires SECONDAIRE, ne se divisent pas.",
  "visuel": "Boule de 32 px à cœur blanc, trois sous-boules de 12 px ; traînée de fumée noire."
 },
 {
  "id": "EVO_002",
  "nom": "Nuée de phénix",
  "statut": "CO",
  "type": "EVOLUTION",
  "sources": [
   "JUT_002"
  ],
  "catalyseurs": [
   "PAS_007"
  ],
  "comportement": "12 flammes guidées en deux vagues d'éventail, qui reprennent une nouvelle cible si la leur meurt en vol.",
  "valeurs": "18 par flamme ; délai 1,2 s ; Brûlure +1",
  "limites": "Max 3 flammes par cible.",
  "visuel": "Flammes en forme d'oiseaux (4 frames d'ailes), pétales de feu."
 },
 {
  "id": "EVO_003",
  "nom": "Souffle du dragon ancestral",
  "statut": "CO",
  "type": "EVOLUTION",
  "sources": [
   "JUT_004"
  ],
  "catalyseurs": [
   "EQP_018"
  ],
  "comportement": "Le cône continu passe à 120° et 6 m ; les ennemis à 6 cumuls de Brûlure éclatent en braises (propagation).",
  "valeurs": "12 par tick de 0,25 s ; éclatement 30 ; délai 2,2 s",
  "limites": "Éclatement : 1 par cible.",
  "visuel": "Nappe de feu en 3 couches, tête de dragon esquissée au départ."
 },
 {
  "id": "EVO_004",
  "nom": "Déluge d'huile ardente",
  "statut": "CO",
  "type": "EVOLUTION",
  "sources": [
   "JUT_010"
  ],
  "catalyseurs": [
   "EQP_029"
  ],
  "comportement": "Deux gerbes d'huile en V puis embrasement : laisse un lac de flammes de 4 m pendant 4 s.",
  "valeurs": "Embrasement 60 ; lac 10 par tick de 0,5 s ; délai 4,0 s",
  "limites": "1 lac actif.",
  "visuel": "Huile luisante puis mer de flammes à crêtes, sol noirci."
 },
 {
  "id": "EVO_005",
  "nom": "Balle de flamme perforante",
  "statut": "CO",
  "type": "EVOLUTION",
  "sources": [
   "JUT_009"
  ],
  "catalyseurs": [
   "PAS_020"
  ],
  "comportement": "Tir rapide qui perce tout et ricoche une fois sur les obstacles ; laisse une ligne de braises 1 s.",
  "valeurs": "30 ; délai 0,7 s ; vitesse 16 m/s",
  "limites": "—",
  "visuel": "Goutte de feu à cœur blanc et traîne longue."
 },
 {
  "id": "EVO_006",
  "nom": "Halo solaire",
  "statut": "CO",
  "type": "EVOLUTION",
  "sources": [
   "JUT_013"
  ],
  "catalyseurs": [
   "PAS_005"
  ],
  "comportement": "Couronne permanente de 5 feux follets sur deux anneaux contrarotatifs (2 m et 3,5 m).",
  "valeurs": "12 par passage ; Brûlure +1 ; permanente",
  "limites": "Intervalle 0,5 s par follet et par cible.",
  "visuel": "Deux anneaux de flammes, lueur au sol en cercle."
 },
 {
  "id": "EVO_007",
  "nom": "Hydre de braises",
  "statut": "CO",
  "type": "EVOLUTION",
  "sources": [
   "JUT_021"
  ],
  "catalyseurs": [
   "PAS_006"
  ],
  "comportement": "La salamandre se divise en 2 à chaque élimination (max 4 simultanées), chacune poursuivant sa chaîne.",
  "valeurs": "26 par cible ; 5 sauts par salamandre ; délai 1,8 s",
  "limites": "Divisions : profondeur 2.",
  "visuel": "Salamandres à 2 têtes, traînées de braises entrecroisées."
 },
 {
  "id": "EVO_008",
  "nom": "Pression infernale",
  "statut": "CO",
  "type": "EVOLUTION",
  "sources": [
   "JUT_008"
  ],
  "catalyseurs": [
   "PAS_049"
  ],
  "comportement": "L'orbe attire les ennemis ordinaires à 3 m pendant son vol, puis détone en double explosion (implosion puis explosion).",
  "valeurs": "Implosion 40 ; explosion 110 (r 4 m) ; délai 5,0 s",
  "limites": "Max 2 orbes.",
  "visuel": "Orbe noir à anneau orange, implosion en 3 frames puis dôme."
 },
 {
  "id": "EVO_009",
  "nom": "Dragons jumeaux d'eau",
  "statut": "CO",
  "type": "EVOLUTION",
  "sources": [
   "JUT_025"
  ],
  "catalyseurs": [
   "PAS_022"
  ],
  "comportement": "Deux dragons entrelacés (sinusoïdes opposées) ; chaque croisement crée un geyser.",
  "valeurs": "2 × 40 ; geyser 25 (r 1,2 m) ; perce illimité ; délai 2,0 s",
  "limites": "—",
  "visuel": "Deux corps d'eau en double hélice, gerbes aux croisements."
 },
 {
  "id": "EVO_010",
  "nom": "Rempart des marées",
  "statut": "CO",
  "type": "EVOLUTION",
  "sources": [
   "JUT_026"
  ],
  "catalyseurs": [
   "PAS_051"
  ],
  "comportement": "Le mur d'eau reste 2 s en anneau à 2,5 m : bloque tous les projectiles ordinaires, puis s'effondre en vague vers l'extérieur.",
  "valeurs": "Vague 40 ; recul 3 m ; délai 6,0 s",
  "limites": "Télégraphes de boss non bloqués.",
  "visuel": "Anneau d'eau haut de 24 px, écume, effondrement en 4 frames."
 },
 {
  "id": "EVO_011",
  "nom": "Prison des profondeurs",
  "statut": "CO",
  "type": "EVOLUTION",
  "sources": [
   "JUT_027"
  ],
  "catalyseurs": [
   "PAS_050"
  ],
  "comportement": "Jusqu'à 3 prisons simultanées ; à la fin, chaque prison éclate et Trempe à 2 m.",
  "valeurs": "20 par tick de 0,5 s ; durée 3 s ; éclatement 30 ; délai 5,0 s",
  "limites": "Boss : résistance de contrôle.",
  "visuel": "Sphères plus sombres, silhouette déformée, bulles."
 },
 {
  "id": "EVO_012",
  "nom": "Brume du démon",
  "statut": "CO",
  "type": "EVOLUTION",
  "sources": [
   "JUT_028"
  ],
  "catalyseurs": [
   "EQP_016"
  ],
  "comportement": "Brume de 6 m qui suit le joueur ; critique +25 % contre les cibles dedans ; les ennemis dedans s'attaquent parfois (Confus 1 s toutes les 3 s).",
  "valeurs": "Durée 6 s ; délai 9 s",
  "limites": "Télégraphes toujours au-dessus.",
  "visuel": "Brume dense à bord net en dithering, silhouettes ennemies contourées."
 },
 {
  "id": "EVO_013",
  "nom": "Banc de requins missiles",
  "statut": "CO",
  "type": "EVOLUTION",
  "sources": [
   "JUT_029"
  ],
  "catalyseurs": [
   "PAS_053"
  ],
  "comportement": "4 requins chercheurs par salve ; chaque morsure Trempe.",
  "valeurs": "4 × (2 × 20) ; délai 1,4 s",
  "limites": "—",
  "visuel": "Requins en formation serrée, sillages croisés."
 },
 {
  "id": "EVO_014",
  "nom": "Raz-de-marée",
  "statut": "CO",
  "type": "EVOLUTION",
  "sources": [
   "JUT_030"
  ],
  "catalyseurs": [
   "PAS_048"
  ],
  "comportement": "Deux vagues successives (7 m puis 10 m) ; l'inondation reste 6 s et les ennemis y sont ralentis de 30 %.",
  "valeurs": "60 + 40 ; recul 3 m ; délai 8,0 s",
  "limites": "Recul réduit dans les zones alliées.",
  "visuel": "Vague de 32 px à écume en crochets, sol inondé animé."
 },
 {
  "id": "EVO_015",
  "nom": "Lame d'eau infinie",
  "statut": "CO",
  "type": "EVOLUTION",
  "sources": [
   "JUT_034"
  ],
  "catalyseurs": [
   "PAS_020"
  ],
  "comportement": "Jet maintenu 1 s qui balaie 90° ; traverse les obstacles bas et hauts.",
  "valeurs": "30 par tick de 0,2 s ; longueur 14 m ; délai 3,0 s",
  "limites": "—",
  "visuel": "Ligne blanche de 3 px, brume en bordure, entaille au sol."
 },
 {
  "id": "EVO_016",
  "nom": "Mille aiguilles mortelles",
  "statut": "CO",
  "type": "EVOLUTION",
  "sources": [
   "JUT_043"
  ],
  "catalyseurs": [
   "PAS_008"
  ],
  "comportement": "Trois couronnes d'aiguilles sur 3 cibles ; critique garanti sur cible Trempée.",
  "valeurs": "3 × 12 × 5 ; délai 2,4 s",
  "limites": "—",
  "visuel": "Aiguilles blanches en couronnes décalées."
 },
 {
  "id": "EVO_017",
  "nom": "Requin dévoreur de chakra",
  "statut": "CO",
  "type": "EVOLUTION",
  "sources": [
   "JUT_046"
  ],
  "catalyseurs": [
   "EQP_023"
  ],
  "comportement": "Le grand requin absorbe les projectiles ennemis et le chakra des ennemis traversés (+1 chakra chacun) ; explosion finale proportionnelle.",
  "valeurs": "50 ; explosion 40 + 8 par absorption ; délai 7 s",
  "limites": "Plafond de chakra global.",
  "visuel": "Requin de 40 px, gueule qui aspire des particules bleues."
 },
 {
  "id": "EVO_018",
  "nom": "Chidori — Mille oiseaux hurlants",
  "statut": "CO",
  "type": "EVOLUTION",
  "sources": [
   "JUT_049"
  ],
  "catalyseurs": [
   "PAS_023"
  ],
  "comportement": "L'image de frappe enchaîne 3 cibles (4 m entre chacune) ; chaque impact décharge en arc de 2 m.",
  "valeurs": "3 × 80 ; décharge 30 ; délai 2,4 s",
  "limites": "—",
  "visuel": "Filaments épais, cri d'oiseaux en crescendo."
 },
 {
  "id": "EVO_019",
  "nom": "Shiden (Éclair violet)",
  "statut": "OA",
  "type": "EVOLUTION",
  "sources": [
   "JUT_050"
  ],
  "catalyseurs": [
   "PAS_043"
  ],
  "comportement": "Trait de foudre plus fin et plus long (7 m) qui frappe l'élite ou le boss en priorité ; +50 % contre eux.",
  "valeurs": "120 (180 élite/boss) ; délai 3,0 s",
  "limites": "—",
  "visuel": "Foudre violette à cœur blanc, contour clair."
 },
 {
  "id": "EVO_020",
  "nom": "Pluie des mille oiseaux",
  "statut": "CO",
  "type": "EVOLUTION",
  "sources": [
   "JUT_052"
  ],
  "catalyseurs": [
   "PAS_007"
  ],
  "comportement": "3 rafales de 8 aiguilles, chaque rafale vers une cible différente ; toutes Électrisent.",
  "valeurs": "3 × 8 × 8 ; délai 1,2 s",
  "limites": "Électrisé : délai interne par cible respecté.",
  "visuel": "Aiguilles blanches en salves décalées."
 },
 {
  "id": "EVO_021",
  "nom": "Lance tournoyante des mille oiseaux",
  "statut": "CO",
  "type": "EVOLUTION",
  "sources": [
   "JUT_053"
  ],
  "catalyseurs": [
   "PAS_003"
  ],
  "comportement": "La lance de 10 m effectue un tour complet (360°) autour du joueur.",
  "valeurs": "30 par tick de 0,2 s ; durée 1,0 s ; délai 3,0 s",
  "limites": "Obstacles hauts : la lance se raccourcit.",
  "visuel": "Lame zigzag qui balaie un cercle, traînée de 4 frames."
 },
 {
  "id": "EVO_022",
  "nom": "Kirin — Orage perpétuel",
  "statut": "CO",
  "type": "EVOLUTION",
  "sources": [
   "JUT_054"
  ],
  "catalyseurs": [
   "EQP_034"
  ],
  "comportement": "Le nuage reste en place après la foudre et lance des éclairs secondaires 4 s ; la construction passe à 4 s.",
  "valeurs": "150 ; éclairs 20 × 10 ; délai 12 s",
  "limites": "Micro-pause locale uniquement.",